{"schemaVersion":"1.0","id":"m9-frostbound-visual-review","version":"1.0.0","status":"ready-for-human-review","technicalPreflight":{"role":"hard-gate-only","checks":[{"id":"deterministic-reproduction","status":"not-assessed"},{"id":"stable-ids","status":"not-assessed"},{"id":"provenance-and-receipts","status":"not-assessed"},{"id":"engine-neutral-delivery","status":"not-assessed"},{"id":"editable-structure","status":"not-assessed"},{"id":"recorded-seeds","status":"not-assessed"},{"id":"no-reference-pixels","status":"not-assessed"},{"id":"functional-bounds","status":"not-assessed"},{"id":"target-phone-readability","status":"not-assessed"}]},"reviewSurfaces":[{"distance":"source","logicalSize":{"width":1080,"height":1920},"requiredChecks":["edge-stack-order","material-channels","clipping","facets","variation-masks","layer-isolation"],"evidence":["M9-E-source-scale"]},{"distance":"target-phone","logicalSize":{"width":540,"height":960},"requiredChecks":["text-state-readability","focal-clarity","border-density","glow-restraint","content-bounds","action-hierarchy","v8-o001-focal-over-panel-pattern"],"evidence":["M9-E-target-phone"]},{"distance":"thumbnail","logicalSize":{"width":135,"height":240},"requiredChecks":["silhouette","focal-dominance","action-separation","panel-pattern-restraint","composition-path","v8-o001-focal-over-panel-pattern"],"evidence":["M9-E-thumbnail"]}],"visualScore":{"scale":"0-5","dimensions":[{"id":"silhouette","weight":10},{"id":"material-separation","weight":15},{"id":"edge-hierarchy","weight":15},{"id":"shared-lighting","weight":10},{"id":"focal-strength","weight":15},{"id":"ornament-restraint","weight":10},{"id":"seeded-variation","weight":10},{"id":"composition","weight":10},{"id":"mobile-readability","weight":5}]}}
